{
  "checks": [
    {
      "details": "lxml parsed map-optimized.svg successfully.",
      "id": "svg-xml-valid",
      "status": "passed"
    },
    {
      "details": "0 0 2384 1684",
      "id": "svg-viewbox",
      "status": "passed"
    },
    {
      "details": {
        "total": 405,
        "unique": 405
      },
      "id": "svg-unique-ids",
      "status": "passed"
    },
    {
      "details": [],
      "id": "svg-no-external-resources",
      "status": "passed"
    },
    {
      "details": {
        "total": 295,
        "unique": 295
      },
      "id": "stand-unique-ids",
      "status": "passed"
    },
    {
      "details": {
        "total": 295,
        "uniqueCodes": 295
      },
      "id": "stand-unique-codes",
      "status": "passed"
    },
    {
      "details": {
        "total": 216,
        "unique": 216
      },
      "id": "exhibitor-unique-ids",
      "status": "passed"
    },
    {
      "details": {
        "total": 102,
        "unique": 102
      },
      "id": "poi-unique-ids",
      "status": "passed"
    },
    {
      "details": {
        "missing": []
      },
      "id": "svg-stand-id-correspondence",
      "status": "passed"
    },
    {
      "details": {
        "missing": []
      },
      "id": "svg-poi-id-correspondence",
      "status": "passed"
    },
    {
      "details": [],
      "id": "stand-geometries",
      "status": "passed"
    },
    {
      "details": [],
      "id": "relationship-references",
      "status": "passed"
    },
    {
      "details": "All stand exhibitor IDs exist.",
      "id": "stand-exhibitor-crossrefs",
      "status": "passed"
    },
    {
      "details": "All exhibitor stand IDs exist.",
      "id": "exhibitor-stand-crossrefs",
      "status": "passed"
    },
    {
      "details": "All stand category IDs exist.",
      "id": "category-crossrefs",
      "status": "passed"
    },
    {
      "details": "9 JSON documents validated.",
      "id": "json-schema-validation",
      "status": "passed"
    },
    {
      "details": {
        "bytes": 2638371
      },
      "id": "svg-rendered-by-inkscape",
      "status": "passed"
    },
    {
      "details": {
        "criterion": "PSNR >= 34 dB and MAE <= 3.5",
        "meanAbsoluteError": 0.0,
        "psnrDb": 99.0
      },
      "id": "visual-fidelity",
      "status": "passed"
    },
    {
      "details": {
        "bytes": 4802809
      },
      "id": "full-vector-svgz-valid",
      "status": "passed"
    }
  ],
  "generatedAt": "2026-08-05T23:24:59Z",
  "schemaVersion": "1.0.0",
  "source": {
    "file": "BIL26-0526.pdf",
    "page": 1,
    "type": "pdf-map"
  },
  "summary": {
    "checksFailed": 0,
    "checksPassed": 19,
    "overallStatus": "passed-with-review-items",
    "pointsOfInterestNeedsReview": 51,
    "pointsOfInterestValidated": 51,
    "standsNeedsReview": 51,
    "standsValidated": 244,
    "unresolvedItemCount": 97
  }
}